Category,Pool,Question,Option A,Option B,Option C,Option D,Correct Answer,Fact
"History","daily","With which Greek philosopher would you associate the phrase, ""I know that I know nothing""?","Socrates","Pythagoras","Plato","Aristotle","A",""
"History","daily","Who was the first wife of King Henry VIII?","Catherine of Aragon","Anne of Cleves","Anne Boleyn","Jane Seymour","A",""
"History","daily","Which U.S. President was in office when the Gulf War began?","George H. W. Bush","Ronald Regan","George W. Bush ","Richard Nixon","A",""
"History","daily","Which country did the Eureka Rebellion, an 1856 battle against colonial rule, take place in?","Canada","India","Brazil","Australia","D",""
"History","daily","Where was Portuguese explorer Ferdinand Magellan killed in 1521?","The Phillipines","Argentina","Guam","Canary Islands","A",""
"History","daily","Which historical conflict killed the most people?","World War II","Mongol conquests","Three Kingdoms War","Taiping Rebellion","A",""
"History","daily","According to scholarly estimates, what percentage of the world population at the time died due to Tamerlane's conquests?","<1%","5%","3%","1%","B",""
"History","daily","Which of the following ancient Near Eastern peoples still exists as a modern ethnic group?","Elamites","Assyrians","Hittites","Babylonians","B",""
"History","daily","Which U.S. president was said to have been too honest to lie to his father about chopping down a cherry tree?","Abraham Lincoln","George Washington","Thomas Jefferson","James Monroe","B",""
"History","daily","Which of these theoretical phycisists first predicted the existence of antimatter?","Werner Heisenberg","Niels Bohr","Albert Einstein","Paul Dirac","D",""
"History","daily","The ""Trail of Tears"" was a result of which United States President's Indian Removal Policy?","Martin Van Buren","Harry S. Truman","John Quincy Adams","Andrew Jackson","D",""
"History","daily","How was Socrates executed?","Poison","Crucifixion ","Firing squad","Decapitation","A",""
"History","daily","In 1453, which important city fell?","Rome","Athens","Hamburg","Constantinople","D",""
"History","daily","The collapse of the Soviet Union took place in which year?","1990","1992","1991","1891","C",""
"History","daily","The Ottoman Empire was dissolved after their loss in which war?","Second Balkan War","Serbian Revolution","Crimean War","World War I","D",""
"History","daily","During the Mongolian invasions of Japan, what were the Mongol boats mostly stopped by?","Tornados","Economic depression","Samurai","Typhoons","D",""
"History","daily","The Herero genocide was perpetrated in Africa by which of the following colonial nations?","Britain","Belgium","France","Germany","D",""
"History","daily","What was found in 1946 by two young shepards near a cave?","Dead Sea Scrolls","The Blackbeard Chest","The First Oaxaca Cave Sleeper","Sheep","A",""
"History","daily","Which Apollo mission was the last one in NASA's Apollo program?","Apollo 17","Apollo 11","Apollo 13","Apollo 15","A",""
"History","daily","In 1939, Britain and France declared war on Germany after it invaded which country?","Poland","Czechoslovakia","Hungary","Austria","A",""
"History","daily","What did the abbreviation ""RMS"" stand for in the RMS Titanic in 1912?","Royal Majesty Service","Regulated Maelstrom Sensor","Royal Mail Ship","Regular Maritime Schedule ","C",""
"History","daily","Which one of these tanks was designed and operated by the United Kingdom?","T-34","M4 Sherman","Tiger H1","Tog II","D",""
"History","daily","Which King of England was faced with the Peasants' Revolt in 1381?","Edward III","Edward II","Richard II","Henry IV","C",""
"History","daily","Which U.S. president took part in the Potsdam Conference, where the Allies reached a peace settlement with Germany?","Dwight D. Eisenhower","Harry S. Truman","Franklin D. Roosevelt","Herbert Hoover","B",""
"History","daily","Who was the first ruler of Haiti after the country had gained its independence?","Alexandre Petion","Jean-Jacques Dessalines","Henri Christophe","Toussaint Louverture","B",""
"History","daily","What is the historical name of Sri Lanka?","Myanmar","Ceylon","Colombo","Badulla","B",""
"History","daily","Which Louis was known as 'The Sun King of France'?","Louis XV","Louis XIII","Louis XIV","Louis XVI","C",""
"History","daily","Which one of these countries was NOT in the Central Powers during WWI?","Spain","Austria-Hungary","Germany","Turkey","A",""
"History","daily","The Battle of the Somme in World War I took place in which country?","Germany","Italy","France","Austria","C",""
"History","daily","Who was the President of the United States during the signing of the Gadsden Purchase?","Andrew Johnson","Abraham Lincoln","James Polk","Franklin Pierce","D",""
"History","daily","What was the last colony the UK ceded marking the end of the British Empire?","Hong Kong","Ireland","Australia","India","A",""
"History","daily","Which of these positions did the astronomer and physicist Isaac Newton not hold?","Surveyor to the City of London","Member of Parliament","Warden of the Royal Mint","Professor of Mathematics","A",""
"History","daily","List the following Iranic empires in chronological order:","Median, Achaemenid, Sassanid, Parthian","Achaemenid, Median, Parthian, Sassanid","Achaemenid, Median, Sassanid, Parthian","Median, Achaemenid, Parthian, Sassanid","D",""
"History","daily","How old was Adolf Hitler when he died?","47","65","43","56","D",""
"History","daily","When did Norway become free from Sweden?","1925","1905","1814","1834","B",""
"History","daily","Who was the first man to travel into outer space twice?","Yuri Gagarin","Charles Conrad","Vladimir Komarov","Gus Grissom","D",""
"History","daily","What year did the Boxing Day earthquake & tsunami occur in the Indian Ocean?","2006","2008","2004","2002","C",""
"History","daily","Which country was an allied power in World War II?","Soviet Union","Japan","Germany","Italy","A",""
"History","daily","Which Las Vegas casino was originally constructed and operated by mobster Bugsy Siegel?","The Sands","The MGM Grand","The Sahara","The Flamingo","D",""
"History","daily","On what street did the 1666 Great Fire of London start?","Pudding Lane","Houses of Parliament","St Paul's Cathedral","Baker Street","A",""
"History","daily","When did construction of the Suez Canal finish?","1859","1860","1869","1850","C",""
"History","daily","When was Google founded?","Feburary 7th, 2000","October 9, 1997","September 4, 1998","December 12, 1989","C",""
"History","daily","In the year 1900, what were the most popular first names given to boy and girl babies born in the United States?","Joseph and Catherine","William and Elizabeth","George and Anne","John and Mary","D",""
"History","daily","When did the Battle of the Somme begin?","July 2nd, 1916","August 1st, 1916","June 30th, 1916","July 1st, 1916","D",""
"History","daily","What was the capital of South Vietnam before the Vietnam War?","Ho Chi Minh City","Hanoi","Hue","Saigon","D",""
"History","daily"," What Russian automatic gas-operated assault rifle was developed in the Soviet Union in 1947, and is still popularly used today?","MG 42","M16","AK-47","RPK","C",""
"History","daily","In which war did the atomic bombings of Hiroshima and Nagasaki occur?","World War II","World War I","Russo-Japanese War","First Sino-Japanese War","A",""
"History","daily","What was the name of the planned invasion of Japan towards the end of World War II?","Operation Boarding Party","Operation Downfall","Operation Ironclad","Operation Aflame","B",""
"History","daily","What was the first sport to have been played on the moon?","Golf","Soccer","Tennis","Football","A",""
"History","daily","What does the United States of America celebrate during the 4th of July?","The signing of the Declaration of Independence","The ratification of the Constitution","The crossing of the Delaware River","The anniversary of the Battle of Gettysburg","A",""
"History","daily","Which king was killed at the Battle of Bosworth Field in 1485? ","Edward V","Henry VII","James I","Richard III","D",""
"History","daily","Who was the first explorer to sail to North America?","Christopher Columbus","Leif Erikson","Amerigo Vespucci","Ferdinand Magellan","B",""
"History","daily","In which year did the Tokyo Subway Sarin Attack occur?","2001","1995","2011","1991","B",""
"History","daily","Which famous military commander marched an army, which included war elephants, over the Alps during the Second Punic War?","Tiberius","Alexander the Great","Hannibal","Garmanicus","C",""
"History","daily","What is the oldest US state?","Delaware","Virginia","Maine","Rhode Island","A",""
"History","daily","After the 1516 Battle of Marj Dabiq, the Ottoman Empire took control of Jerusalem from which sultanate?","Ayyubid","Ummayyad","Seljuq","Mamluk","D",""
"History","daily","Who was the first Chancellor of a united Germany in 1871? ","Otto Von Bismark","Robert Koch","Fredrick the 2nd","Kaiser Wilhelm ","A",""
"History","daily","In what year did the First World War end?","1914","1916","1912","1918","D",""
"History","daily","In what year did the North American Video Game Crash occur?","1982","1993","1970","1983","D",""
"History","daily","What is the name of the ship which was only a few miles away from the RMS Titanic when it struck an iceberg on April 14, 1912?","Commerce","Carpathia","Californian","Cristol","C",""
"History","daily","The Bohemian Revolt (1618-1620) started after Protestants in Prague did what to their Catholic Lords Regents?","Insulted their mothers","Threw them out of a window","Locked them in stockades","Hung them.","B",""
"History","daily","What was the unofficial name for Germany between 1919 and 1933?","Oesterreich ","Weimar Republic","German Democratic Republic","Federal Republic of Germany","B",""
"History","daily","During which American Civil War campaign did Union troops dig a tunnel beneath Confederate troops to detonate explosives underneath them?","Gettysburg Campagin","Siege of Petersburg","Antietam Campaign","Siege of Vicksburg","B",""
"History","daily","Which of the following African countries was most successful in resisting colonization?","Ethiopia","C&ocirc;te d'Ivoire","Congo","Namibia","A",""
"History","daily","In 1547 who became the 1st Tsar of Russia","Alexis of Russia","Ivan the Terrible","Mikhail Romanov","Peter the Great","B",""
"History","daily","To what political party did Abraham Lincoln belong when elected POTUS?","Democrat","Republican","Independent","Whig","B",""
"History","daily","What is the bloodiest event in United States history, in terms of casualties?","D-Day","September 11th","Pearl Harbor","Battle of Antietam","D",""
"History","daily","When was the Grand Patriotic War in the USSR concluded?","September 2nd, 1945","August 9th, 1945","December 11th, 1945","May 9th, 1945","D",""
"History","daily","On which day did the attempted coup d'etat of 1991 in the Soviet Union begin?","December 24","August 19","August 21","December 26","B",""
"History","daily","In what year did the Berlin Wall fall?","1989","1993","1991","1987","A",""
"History","daily","Which English king was married to Eleanor of Aquitaine?","Henry V","Henry I","Henry II","Richard I","C",""
"History","daily","The minigun was designed in 1960 by which manufacturer.","Colt Firearms","Heckler & Koch","General Electric","Sig Sauer","C",""
"History","daily","Which Nazi General was known as the ""Desert Fox""?","Gerd von Rundstadt","Wilhelm Keitel","Heinz Guderian ","Erwin Rommel","D",""
"History","daily","Which of his six wives was Henry VIII married to the longest?","Jane Seymour","Catherine Parr","Catherine of Aragon","Anne Boleyn","C",""
"History","daily","Abolitionist John Brown raided the arsenal in which Virginia Town?","Richmond","Harrisonburg","Martinsburg","Harper's Ferry","D",""
"History","daily","In what year did the nuclear power plant in Chernobyl melt down?","1986","1975","1998","1991","A",""
"History","daily","Which of the following Physicists aided Nazi Germany in their production of a nuclear weapon?","Max Planck","Albert Einstein","Werner Heisenberg","John von Neumann","C",""
"History","daily","The ancient city of Chichén Itz&aacute; was built by which civilization?","Mayans","Toltecs","Incas","Aztecs","A",""
"History","daily","What were the first states to break away from Yugoslavia?","Macedonia, Montenegro","Slovenia, Macedonia","Montenegro, Slovenia","Slovenia, Croatia","D",""
"History","daily","When did the Battle of the Bulge end?","December 7, 1941","January 25, 1945","December 16, 1944","August 6, 1945","B",""
"History","daily","When did Norway get its constitution?","1854","1932","1814","1905","C",""
"History","daily","Toussaint Louverture led a successful slave revolt in which country?","Haiti","France","Cuba","United States","A",""
"History","daily","How many manned moon landings have there been?","1","3","7","6","D",""
"History","daily","What is the name of the famous Apache leader who died in 1909 at the age of 70?","Sitting Bull","Red Cloud","Crazy Horse","Geronimo","D",""
"History","daily","When did the Crisis of the Third Century begin?","242 AD","235 BC","235 AD","210 AD","C",""
"History","daily","Which American civilization is the source of the belief that the world would end or drastically change on December 21st, 2012?","The Aztecs","The Incas","The Mayans","The Navajos","C",""
"History","daily","Which Roman Emperor led the Roman Empire to reach its maximum territorial extent?","Julius Caesar","Trajan","Claudius","Constantine the Great","B",""
"History","daily","Who led the Communist Revolution of Russia?","Vladimir Lenin","Mikhail Gorbachev","Vladimir Putin","Joseph Stalin","A",""
"History","daily","Which country gifted the Statue of Liberty to the United States of America?","Germany","Spain","France","England","C",""
"History","daily","Which game was the Game of the Year in 2018?","God of War","A Way Out","Red Dead Redemption 2","Detroit: Become Human","A",""
"History","daily","When Christopher Columbus sailed to America, what was the first region he arrived in?","The Bahamas Archipelago","Nicaragua","Isthmus of Panama","Florida","A",""
"History","daily","In the Seven Wonders of the World, which wonder is the only that has survived to this day?","Colossus of Rhodes","Lighthouse of Alexandria","Statue of Zeus at Olympia","Great Pyramid of Giza","D",""
"History","daily","What is the name of the Boeing B-29 that dropped the 'Little Boy' atomic bomb on Hiroshima?","Enola Gay","Full House","The Great Artiste","Necessary Evil","A",""
"History","daily","When did Canada leave the confederation to become their own nation?","July 1st, 1867","July 1st, 1902","July 1st, 1763","July 1st, 1832","A",""
"History","daily","Who was among those killed in the 2010 Smolensk, Russia plane crash tragedy?","Pope John Paul II","Bang-Ding Ow","Albert Putin","The Polish President","D",""
"History","daily","Who tutored Alexander the Great?","King Philip","Socrates","Aristotle","Plato","C",""
"History","daily","During the Spanish Civil War (1936), Francisco Franco fought for which political faction?","Popular Front","Republican Spain","Nationalist Spain","Papal State","C",""
"History","daily","Who was the Prime Minister of Japan when Japan declared war on the US?","Hideki Tojo","Fumimaro Konoe","Michinomiya Hirohito","Isoroku Yamamoto","A",""
"History","daily","In what year did the Great Northern War, between Russia and Sweden, end?","1727","1721","1726","1724","B",""
"History","daily","Who was the first prime minister of Canada?","Robert Borden","Alexander Mackenzie","John Abbott","John Macdonald","D",""
"History","daily","What was the name of the spy ring that helped the United States win the Revolutionary War?","New York Spy Ring","Culper Ring","Washington's Spies","Unnamed","B",""
"History","daily","In 1961, an American B-52 aircraft crashed and nearly detonated two 4mt nuclear bombs over which US city?","Jacksonville, Florida","Goldsboro, North Carolina","Hicksville, New York","Conway, Arkansas","B",""
"History","daily","Who was the last Roman emperor in the Year of Four Emperors (69 AD)?","Vitellius","Galba","Otho","Vespasian","D",""
"History","daily","What country joined the EU in 2013?","Bulgaria","Slovenia","Turkey","Croatia","D",""
"History","daily","Who invented the ""Flying Shuttle"" in 1738; one of the key developments in the industrialization of weaving?","John Kay","John Deere","Richard Arkwright","James Hargreaves","A",""
"History","daily","Who is believed to have been the first European to 'discover' the land of New Zealand?","Abel Tasman","John Cabot ","Jeanne Baré","Christopher Columbus","A",""
"History","daily","The main objective of the German operation ""Case Blue"" during World War II was originally to capture what?","Crimea","Stalingrad","Caucasus","Voronezh","C",""
"History","daily","Which Nation did NOT have a Colony in modern-day North America?","Spain","Sweden","Netherlands","Portugal","D",""
"History","daily","Which of these countries was NOT a part of the Soviet Union?","Uzbekistan","Afghanistan","Turkmenistan","Kazakhstan","B",""
"History","daily","What was the real name of the Albanian national leader Skanderbeg?","Diturak Zhulati","Gjergj Kastrioti","Iskander Bejko","Mirash Krasniki","B",""
"History","daily","How many times was Albert Einstein married in his lifetime?","Five","Thrice","Twice","Once","C",""
"History","daily","How long did the Warsaw Uprising during World War II last?","224 Days","55 Days","63 Days","20 Days","C",""
"History","daily","Which day did World War I begin?","January 28","July 28","June 28","April 28","B",""
"History","daily","Who was the leader of the Communist Party of Yugoslavia ?","Josip Broz Tito","Aleskandar Petrovic","Milos Obilic","Karadjordje Petrovic","A",""
"History","daily","During WWII, in 1945, the United States dropped atomic bombs on the two Japanese cities of Hiroshima and what other city?","Tokyo","Kagoshima","Nagasaki","Kawasaki","C",""
"History","daily","Which countries participated in the Lobster War?","France and Brazil","United States and England","Australia and New Zealand","Canada and Norway","A",""
"History","daily","Who was the leader of Sweden in the Great Northern War?","Per Albin Hansson","Gustavus Adolphus","Peter the Great","Charles XII","D",""
"History","daily","What was Genghis Khan's real name?","Temür","&Ouml;gedei","Temüjin","Möngke","C",""
"History","daily","The idea of Socialism was articulated and advanced by whom?","Joseph Stalin","Vladimir Lenin","Karl Marx","Vladimir Putin","C",""
"History","daily","What Southeast Asian country was formerly known as 'Lan Xang'?","Laos","Vietnam","Thailand","Cambodia","A",""
"History","daily","The pantheon in Rome was used to worship what god?","Zeus","Athena","Any god they wanted","Both Athena and Zeus","C",""
"History","daily","The Tsar Bomba, the most powerful nuclear bomb ever tested, had a yield of 50 megatons but theoretically had a maximum yield of how much?","100 Megatons","150 Megatons","75 Megatons","200 Megatons","A",""
"History","daily","Before the American colonies switched to the Gregorian calendar in 1752, on what date did their new year start?","June 1st","March 25th","September 25th","December 1st","B",""
"History","daily","During World War I, which nation's monarchs were blood related?","France, Russia, Germany","Serbia, Russia, Croatia","Germany, Spain, Austria","England, Germany, Russia","D",""
"History","daily","The Panama Canal was finished under the administration of which U.S. president?","Herbert Hoover","Woodrow Wilson","Franklin Delano Roosevelt","Theodore Roosevelt","B",""
"History","daily","Who assassinated President James A. Garfield?","Leon Czolgosz","John Wilkes Booth","Charles Guiteau","Sirhan Sirhan","C",""
"History","daily","Which German field marshal was known as the `Desert Fox`?","Wilhelm List","Erwin Rommel","Wolfram Freiherr von Richthofen","Ernst Busch","B",""
"History","daily","When did Lithuania declare independence from the Soviet Union?","December 25th, 1991","December 5th, 1991","March 11th, 1990","April 20th, 1989","C",""
"History","daily","On what day did Germany invade Poland?","December 7, 1941","June 22, 1941","July 7, 1937","September 1, 1939","D",""
"History","daily","What was the name of the chemical that was dropped on Vietnam during the Vietnam war?","Phosgene","Mustard Gas","Hydrogen Cyanide","Agent Orange","D",""
"History","daily","Which modern day country is the region that was known as Phrygia in ancient times?","Syria","Greece","Egypt","Turkey","D",""
"History","daily","Under which name was Rodrigo Borgia made Pope?","Rodrigo I","John Paul II","Pius VII","Alexander VI","D",""
"History","daily","What is the name given to the series of confrontations between the UK and Iceland over North Atlantic fishing rights?","The Cod Wars","The Halibut Wars","The Mackerel Wars","The Lobster Wars","A",""
"History","daily","In what dialogue did Socrates defend himself to the court of Athens? ","The Euthyphro","The Laws","The Republic","The Apology","D",""
"History","daily","Which Greek god was the god of the Sun?","Poseidon","Hades","Zeus","Helios","D",""
"History","daily","Which of these countries remained neutral during World War II?","Switzerland","France","United Kingdom","Italy","A",""
"History","daily","What event marked the start of World War II?","Invasion of Russia (1942)","Battle of Britain (1940)","Invasion of Normandy (1944)","Invasion of Poland (1939)","D",""
"History","daily","Spain was formed in 1469 with the marriage of Isabella I of Castile and Ferdinand II of what other Iberian kingdom?","Galicia","Le&oacute;n","Navarre","Aragon","D",""
"History","daily","When was Finland's 100th year of being independent?","2018","2015","2017","2016","C",""
"History","daily","Which of these founding fathers of the United States of America later became president?","Roger Sherman","Alexander Hamilton","James Monroe","Samuel Adams","C",""
"History","daily","When did O, Canada officially become the national anthem?","1980","1950","1880","1920","A",""
"History","daily","What age was King Henry V when he died?","62","87","73","35","D",""
"History","daily","Which of the following physicists did NOT work on the Manhattan project?","Richard Feynman","Murray Gell-Mann","J. Robert Oppenheimer","John Von-Neumann","B",""
"History","daily","The Second Boer War in 1899 was fought where?","Nepal","Argentina","South Africa","Bulgaria","C",""
"History","daily","In which year did the Invasion of Kuwait by Iraq occur?","1990","1986","1988","1992","A",""
"History","daily","One of the deadliest pandemics, the ""Spanish Flu"", killed off what percentage of the human world population at the time?","6 to 10 percent","3 to 6 percent","1 to 3 percent","less than 1 percent","B",""
"History","daily","What disease crippled President Franklin D. Roosevelt and led him to help the nation find a cure? ","Polio","Cancer","Meningitis","HIV","A",""
"History","daily","What was the bloodiest single-day battle during the American Civil War?","The Battle of Antietam","The Battles of Chancellorsville","The Battle of Gettysburg","The Siege of Vicksburg","A",""
"History","daily","Which naval battle was considered the turning point of the Pacific Ocean Theater during World War 2?","Attack on Truk Island","Attack on Pearl Harbor","Battle of the Coral Sea","Battle of Midway","D",""
"History","daily","Who was the first President of the People's Republic of China?","Li Xiannian","Dong Biwu","Mao Zedong","Liu Shaoqi","C",""
"History","daily","What is the mnemonic device for remembering the fates of the wives of Henry VIII?","Beheaded, Died, Divorced, Divorced, Beheaded, Survived","Died, Beheaded, Divorced, Beheaded, Survived, Divorced","Survived, Beheaded, Died, Divorced, Divorced, Beheaded","Divorced, Beheaded, Died, Divorced, Beheaded, Survived","D",""
"History","daily","What year was Canada founded in?","1798","1859","1668","1867","D",""
"History","daily","Who was the first president of the United States?","George Washington","James K. Polk","Thomas Jefferson","James Madison","A",""
"History","daily","Who famously coined the phrase ""I think, therefore I am""?","Descartes","Aristotle","Plato","Shakespeare","A",""
"History","daily","The United States Army Air Corps became the United States Air Force on what date?","December 14, 1946","October 27, 1945","November 08, 1944","September 18, 1947","D",""
"History","daily","What year is considered to be the year that the British Empire ended?","1997","1971","1981","1986","A",""
"History","daily","Which country attacked the USS Liberty on June 8, 1967?","Israel","Syria","Saudi Arabia","Iran","A",""
"History","daily","What year did World War I begin?","1914","1905","1919","1925","A",""
"History","daily","Which country was Josef Stalin born in?","Georgia","Germany","Russia","Poland","A",""
"History","daily","What number does the Roman numeral ""D"" stand for?","100","50","1000","500","D",""
"History","daily","What was the original name of New York City?","New Rome","New London","New Paris","New Amsterdam","D",""
"History","daily","Which of the following Presidents of the United States was assassinated?","Chester Arthur","William McKinley","Lyndon Johnson","Franklin Roosevelt","B",""
"History","daily","The crown of the Empire State Building was originally built for what purpose?","Airship Dock","Flag Pole","Antennae","Lightning Rod","A",""
"History","daily","What was the total length of the Titanic?","882 ft | 268.8 m","759 ft | 231.3 m","1042 ft | 317.6 m","825 ft | 251.5 m","A",""
"History","daily","Adolf Hitler was born on which date?","April 20, 1889","June 12, 1889","February 6, 1889","April 16, 1889","A",""
"History","daily","Who was the main developer of the Suez Canal?","Johann Lukas von Hildebrandt","Louis-Eug&egrave;ne Cavaignac","John Milton","Ferdinand de Lesseps","D",""
